id_projeto,titulo,classificacao_primaria,classificacao_secundaria,data_inicio,data_conclusao,situacao,coordenador,unidade_lista,sigla_unidade_lista,resumo,palavra_chave_1,palavra_chave_2,palavra_chave_3,palavra_chave_4,apresentacao,unidade_extensao,sigla_unidade_extensao,score_rrf,score_dense,score_bm25,is_stem
170,FORDAN: Cultura no enfrentamento ás violências ,Extensão,Programa de Extensão,2022-07-18,2028-12-13,Ativo,ROSELY MARIA DA SILVA PIRES,Departamento de Ginástica,DG/CEFD,"O Programa nasce com objetivo de transformar o projeto Fordan cadastrado em 2013(400559) foi criado em 2005 com o nome de ""Dança e Educação"" . Ele agrega 3 projetos cadastrados:A CULTURA POPULAR: PROBLEMATIZAÇÃO E ENFRENTAMENTO DA VIOLÊNCIA; LIDA; Formação de Educadores: A construção de um mundo sem violência. (Por atuar no enfrentamento e problematização a complexidade das violências contra a mulher, crianças, racismo, LGBTQIs foi necessário que o projeto buscasse incorporar profissionais de outras áreas para as inúmeras atividades de acolhimento) O projeto acontece em dois espaços: CEFD/UFES e; São Pedro I (espaço de acolhimento de famílias em vulnerabilidade ás terças e sábado a tarde). O programa agrega o grupo de Dança Fordan CEFD/UFES e os Núcleo Sócio-Jurídico;  Núcleo Terapêutico e Núcleo de Educação e Cultura que foram criados em São Pedro com objetivo de atender vulnerabilidade e principalmente crianças, mulheres e jovens que sofrem processos de violência. ",Cultura,Violência,multidisciplinar,Direitos-humanos,"Este Programa agrega projetos que foram registrados na Proex desde 2013. O Programa atua em duas frentes: Fordan São Pedro com  Núcleos de enfrentamento as violências contra a mulher, criança e jovem, Racismo e LGBTQifobia (atua no acolhimento a famílias em vulnerabilidade social); Grupo de dança Fordan CEFD/UFES (atua com produção de espetáculos de dança produzindo a reflexão sobre as temáticas do Direito Humano). Em 2005 fundamos o projeto de Extensão “Fordan: Cultura no Enfrentamento as violências” que atua no fortalecimento da criança na periferia de Vitória, ES. Até 2009 o projeto foi conhecido como “Dança e Educação” e as ações estavam restritas a dar formação para os educadores da instituição LBV e aula de Cultura para as 160 crianças da instituição. Foi em 2015 com a escuta mais sensível das dores das crianças que acolhíamos, prestando atenção na campanha nacional “Quem ama abraça pelo fim da violência contra a mulher” e principalmente fazendo a escuta do sofrimento de uma estudante - que  havia sofrido violência doméstica durante 24 anos - que decidimos incluir essa agenda. ",Departamento de Ginástica,DG/CEFD,0.011750721684496519,0.85097176,19.08297345216152,False
1392,Abordagem fisioterapêutica na saúde da mulher,Extensão,Projeto de Extensão,2016-08-01,2026-12-30,Ativo,NEVILLE FERREIRA FACHINI DE OLIVEIRA,Departamento de Educação Integrada em Saúde,DEIS/CCS,"A Saúde da Mulher é uma especialidade da Fisioterapia na qual o fisioterapeuta deve ter domínio de áreas de competência relacionadas a sistema reprodutor feminino. Para isso, é importante que os Cursos ofertem maior vivência prática, aprimorando o aprendizado. Atualmente, esta oferta ocorre de forma insatisfatória (carga horária e espaço físico) aos alunos do curso de fisioterapia da Universidade Federal do Espírito Santo, em todos os níveis de atenção à saúde, em especial na atenção primária e secundária. Objetivo: Ofertar atendimento fisioterapêutico especializado para mulheres em tratamento para câncer de mama, no ciclo gravídico-puerperal e com risco de ou incapacidades uroginecológicas. Métodos: Serão realizados grupos de estudo para aprimoramento dos alunos, com treinamento quanto a avaliação e intervenções fisioterapêuticas das mulheres. Por fim, serão oferecidos às mulheres atendimento fisioterapêutico especializado para cada condição de saúde.","Fisioterapia, Modalidades",Saúde da Mulher,Assoalho pélvico,Atenção à saúde,"A Fisioterapia na Saúde da Mulher é uma especialidade da Fisioterapia, que se destaca como uma área relativamente nova, que
foi reconhecida recentemente pelo Conselho Federal de Fisioterapia e Terapia Ocupacional em 2011, por meio da
resolução nº 401 (BRASIL, 2011). Tal resolução levanta que para que o fisioterapeuta exerça essa especialidade, é necessário
que o mesmo tenha domínio de técnicas de avaliação e intervenção fisioterapêutica no que diz respeito à Saúde da Mulher.
Para que o fisioterapeuta desenvolva esse domínio, apesar de sua formação ter caráter generalista, é importante que as grades
curriculares dos cursos de graduação contemplem tais conteúdos, desde as disciplinas básicas até as disciplinas consideradas
de cunho eminentemente prático. Além do mais, oferecer aos alunos uma vivência prática, sobre os conteúdos discorridos em sala da aula da disciplina de Fisioterapia na Saúde da Mulher, faz com os mesmos possam aprimorar o aprendizado e sua prática clínica.
Apesar da necessidade destacada, a oferta dessa prática ocorre de forma insatisfatória aos alunos do curso de fisioterapia da
Universidade Federal do Espírito Santo (UFES), com relação a carga horária e espaço físico para vivência prática em todos os níveis de atenção à saúde, em especial nos níveis primário e secundário na área de Saúde da Mulher.
",Departamento de Educação Integrada em Saúde,DEIS/CCS,0.011611492196043346,0.8428812,26.254790898882344,False
3366,"Gemoa-Opressões de classe, raça e sexo.",Extensão,Projeto de Extensão,2022-09-20,2025-12-08,Concluído,MARIA CRISTINA LONGO CARDOSO DIAS,Departamento de Filosofia,DF/CCHN,"O projeto visa à divulgação do pensamento de Marx e de outros autores e autoras desta vertente que entrelacem opressões de classe, raça e sexo, para divulgação de tais pensamentos dentro da comunidade da UFES, bem como da comunidade externa . A base para a realização do projeto é composta de alunos e alunas de graduação, mestrado e doutorado, bem como dos públicos externos que quinzenalmente pretendem se reunir para leitura e discussão dos mais variados textos relacionados à temática, podendo difundir tais pensamentos em minicursos, eventos e outras atividades que possam envolver pessoas da academia e da comunidade externa que possuam interesse. Ressalta-se que este projeto de extensão é uma continuação de projetos anteriores, por mim coordenados na instituição de onde vim redistribuída (UFRN). Um minicurso cadastrado na PROEX/UFRN pela coordenadora, em 2020, atingiu pessoas de todo país e algumas de outros lugares do mundo, excedendo o total de inscrições possíveis.",Opressões,Classe,Raça,Sexo,"O projeto visa à divulgação do pensamento de Marx e de outros autores e autoras desta vertente que entrelacem opressões de classe, raça e gênero, para divulgação de tais pensamentos dentro da comunidade da UFES, bem como da comunidade externa. A base para a realização do projeto é composta de alunos e alunas de graduação, mestrado e doutorado da coordenadora do projeto que quinzenalmente pretendem se reunir para leitura e discussão dos mais variados textos relacionados à temática, difundindo tais pensamentos em minicursos, eventos e outras atividades que envolvam pessoas da academia e da comunidade externa que possuam interesse.",Departamento de Filosofia,DF/CCHN,0.01148844606604921,0.8575268,11.064790507462945,False
822,"Território de re-existência: diálogos entre psicologia, formação e teatro na política da juventude",Extensão,Projeto de Extensão,2017-12-01,2019-07-31,Concluído,JANAINA MARIANO CESAR,Departamento de Psicologia,DP/CCHN,"Este projeto, vincula-se  à Coordenação de Políticas Públicas dos Direitos das Juventudes/ Secretaria de Cidadania e Direitos Humanos (SECIM/Vitória-ES), tendo sua inserção em dois equipamentos: Primeiro ano: Casa da Juventude (São Pedro, Vitória/ES); Segundo ano: Núcleo Afro Odomodê (Morro do Quadro, Vitória/ES). Objetiva a construção de oficinas teatrais como espaço estético-formativo, clínico-político, para o enfrentamento a processos de violência. Tem como público-alvo jovens mulheres de 15 a 29 anos. O projeto tem se estruturado: no acompanhamento do cotidiano das ações da política da juventude nos equipamentos investidos e construção de oficinas. Estas promovem o cultivo de grupalidade, em que o vínculo e confiança possibilitam partilhas de experiências de violência sofridas e acesso a uma experiência coletiva; o encontro da psicologia com o tema da violência contra mulher e das relações étnico-raciais e a reapropriação do corpo-território expressivo e potente.  ",Psicologia,juventude,mulher ,teatro,"Este projeto, vincula-se  à Coordenação de Políticas Públicas dos Direitos das Juventudes/ Secretaria de Cidadania e Direitos Humanos (SECIM/Vitória-ES), tendo sua inserção em dois equipamentos: Em 2017-2018: Casa da Juventude (São Pedro, Vitória/ES); Em 2019: Núcleo Afro Odomodê (Morro do Quadro, Vitória/ES). 
Os equipamentos atendem às políticas públicas inauguradas com o Estatuto da Juventude (Lei 12.852/2013), que institui os direitos das Juventudes, como o direito à cultura, à educação e ao protagonismo social, compreendendo como jovem toda pessoa entre 15 a 29 anos (BRASIL, 2014). Assim, pretende-se um espaço de acesso profissional e artístico, como também um espaço de convivência e troca entre os jovens.
A relação com SECIM e a Casa da Juventude, primeira inserção do projeto, inicia-se a partir de atividades de estágio (Estágio Básico 1, ofertada pelo Departamento de Psicologia) entre os anos de 2016/2017.
Durante o período de permanência na instituição acompanhamos o cotidiano da Casa como ponto de encontro em que jovens compartilham vivências e produzem vínculos. Deparamo-nos com relatos de jovens sobre a violência contra a mulher vivida direta ou indiretamente. Muitas delas ainda que experimentando algum tipo de violência emocional, psicológica ou física, não organizam para si tal vivência como sendo de violência, o que aponta processos de naturalização a respeito da violência contra mulheres. Aquelas que percebem essa dimensão por vezes reproduzem o discurso sociocultural que responsabiliza e culpabiliza a mulher pela violência sofrida.
É nesse contexto que este projeto se constroe: observando que a garantia dos direitos humanos das mulheres no Brasil se encontra ainda em processo e que é necessário construir processos de intervenção nessa direção. Para tal, articula-se com ferramentas conceituais da psicologia,  o teatro como dispositivo artístico corporal e o cultivo grupal como modo de acesso a uma experiência coletiva.
",Departamento de Psicologia,DP/CCHN,0.011409418136186513,0.8410179,26.452570261692287,False
3854,"VI SIMPÓSIO DE DIVERSIDADE ÉTNICO-RACIAL: POLÍTICAS AFIRMATIVAS, FORMAÇÃO DE PROFESSORES(AS) E PRÁTICAS EDUCATIVAS",Extensão,Evento de Extensão,2023-06-20,2023-06-22,Concluído,MARILEIDE GONCALVES FRANCA,Departamento de Medicina Veterinária,DMV/CCAE,"O VI Simpósio de Diversidade Étnico-Racial: políticas afirmativas, formação de professores(as) e práticas educativas pretende se constituir como espaço tempo de diálogo e reflexão sobre a Educação das relações étnico-raciais, sua articulação com as políticas públicas, formação de professores(as) e práticas educativas voltadas aos estudantes negros(as) e indígenas nos diferentes sistemas educacionais brasileiros. Assim, a sexta edição do evento consubstancia o trabalho desenvolvido por pesquisadores(as)/professores(as) e movimentos sociais vinculados a Universidade do Espírito Santo, ao Programa de Pós-Graduação em Ensino, Educação Básica e Formação de Professores (PPGEEDUC/Ufes) e ao ""Grupo de Estudo Étnico-Racial e Educação Especial"" (GEERE); e pesquisadores da Universidade Federal de Mato Grosso e Faculdade Latino-Americana de Ciências Sociais (Flacso) que desenvolvem estudos no campo da Educação das Relações Étnico-Raciais. ",ERER,Políticas Afirmativas,Formação de Professores,Praticas Educativas,"O VI Simpósio de Diversidade Étnico-Racial pretende se constituir como espaço tempo de diálogo e reflexão sobre a Educação das relações étnico-raciais, sua articulação com as políticas públicas, formação de professores(as) e práticas educativas voltadas aos estudantes negros(as) e indígenas nos diferentes sistemas educacionais brasileiros. Ressalta-se a importância dessa discussão no contexto político, econômico, social e educacional no país, marcado por (in)tensos debates relacionados ao processo de implementação da Lei nº 10.639, de 9 de janeiro de 2003 que, altera a LDB/96, que estabelece as diretrizes e bases da educação nacional, para incluir no currículo oficial de todos os níveis e modalidades de Ensino a obrigatoriedade da temática “História e Cultura Afro-brasileira”. Assim como, os desafios de sua implementação nos currículos e práticas educativas, com vistas a construção de uma educação antirracista. Esse cenário aponta desafios que necessitam de ampla discussão e posicionamento dos(as) pesquisadores(as) e dos(as) profissionais que atuam nesse campo. Considera-se que esse debate também seja de extrema importância no Espírito Santo, tendo em vista a necessidade de acompanhamento e avaliação da implementação da Lei nº 10.639/03 nas escolas dos municípios capixabas, bem como a incorporação das Diretrizes Curriculares Nacionais para a educação das Relações étnico-raciais (BRASIL, 2004) nas práticas escolares. Assim, a sexta edição consubstancia o trabalho desenvolvido por pesquisadores(as)/professores(as) e movimentos sociais vinculados a Universidade do Espírito Santo, ao Programa de Pós-Graduação em Ensino, Educação Básica e Formação de Professores (PPGEEDUC/Ufes) e ao ""Grupo de Estudo Étnico-Racial e Educação Especial"" (GEERE); e pesquisadores da Universidade Federal de Mato Grosso e Faculdade Latino-Americana de Ciências Sociais (Flacso) que desenvolvem estudos no campo da Educação das Relações Étnico-Raciais.  
",Departamento de Medicina Veterinária,DMV/CCAE,0.011365051687632334,0.8534255,15.406897789332788,False
4828,Vamos falar de saúde sexual?,Extensão,Projeto de Extensão,2024-10-28,2027-03-20,Ativo,FABIANA DAYSE MAGALHAES SIMAN MEIRA,Departamento de Farmácia e Nutrição,DFN/CCENS,"Trata-se de uma ação de extensão realizada no âmbito da disciplina de Farmacologia III do curso de farmácia CCENS/UFES, com o objetivo de disseminar o conhecimento adquirido durante a disciplina aos alunos do ensino médio de uma escola estadual do município de Alegre.",contracepção hormonal,sistema reprodutor,gravidez na adolescência ,,"A   adolescência, período compreendido entre os 10 e 19 anos de idade, é uma etapa de crescimento e desenvolvimento do ser humano, marcada por grandes transformações físicas, psíquicas e sociais. Nesse sentido, todas as transformações pelas quais o adolescente passa, dentre elas, as mudanças no comportamento em relação à sexualidade, exigem atenção por parte dos pais e profissionais, devido às vulnerabilidades associadas à sua saúde reprodutiva. A falta de informação pode resultar em situações como gravidez não planejada, abortos, contaminação por infecções sexualmente transmissíveis, uso prejudicial de álcool e outras drogas, além de exposição a diferentes formas de violência física, psicológica e familiar, entre diversos outros agravos. Diante disso, torna-se evidente a necessidade de ampliar os debates sobre sexualidade com os jovens, para a promoção da saúde sexual e reprodutiva, com foco no reconhecimento do próprio corpo, na orientação sobre comportamentos de proteção e de risco, no rompimento de preconceitos e na discussão das diferentes realidades. Este projeto está vinculado à disciplina de Farmacologia III, ofertada para o curso de Farmácia, CCENS/UFES.",Departamento de Farmácia e Nutrição,DFN/CCENS,0.011335647942075432,0.8599512,7.87401594632269,False
5381,"I Simpósio em Nutrição e Saúde da Mulher, Criança e Adolescente",Extensão,Evento de Extensão,2026-03-30,2026-03-31,Aguardando envio de relatório,MIRIAM CARMO RODRIGUES BARBOSA,Departamento de Nutrição,DN,"Trata-se de uma proposta pioneira para a Grande Vitória, cujo objetivo é suscitar atualizações para profissionais e estudantes capixabas da área da saúde, acerca da Nutrição e Saúde da Mulher, Criança e Adolescente. Este evento é uma sugestão do Grupo de Pesquisa em Nutrição e Saúde da Mulher, Criança e Adolescente (MUCA) da Universidade Federal do Espírito Santo (UFES), coordenado pelas Profas. Dras. Míriam Carmo Rodrigues Barbosa e Carolina Perim de Faria, docentes do curso de graduação em Nutrição e do Programa de Pós-graduação em Nutrição e Saúde da UFES. Este evento também comemora os 10 anos de trajetória do MUCA e foi contemplado no EDITAL FAPES N° 20.2024 ORGANIZAÇÃO DE EVENTOS TÉCNICOCIENTÍFICOS - 2ª CHAMADA 2025. Este evento trata de uma temática essencial e que ainda carece de ser amplamente discutida e difundida entre os profissionais de saúde, dada sua importância e impacto na qualidade de vida dessa população com elevada vulnerabilidade biológica, nutricional e social.",Mulher,Criança,Adolescente,Nutrição e Saúde,"O I Simpósio em Nutrição e Saúde da Mulher, Criança e Adolescente tem como propósito abordar e discutir temas relevantes e atuais, com base em evidências científicas, por profissionais e pesquisadores de renome da área do conhecimento. Nesta primeira edição abordará os seguintes temas: métodos diagnósticos para a avaliação do estado nutricional de Mulheres, Crianças e Adolescentes, obesidade infantil, diabetes gestacional, atuação da equipe multidisciplinar no cuidado à criança e ao adolescente, avaliação do ambiente alimentar escolar. Trata-se de uma proposta pioneira para a Grande Vitória, cujo objetivo é suscitar a cada biênio atualizações para profissionais e estudantes capixabas da área da saúde acerca da Nutrição e Saúde da Mulher, Criança e Adolescente. Pretende-se debater sobre métodos de avaliação, manejos clínicos e atuação multiprofissional de forma que se associe a pesquisa e à prática profissional a fim de fornecer subsídios teórico-práticos de qualidade para os participantes. Pretende-se ainda fomentar a discussão de estratégias para a implementação de protocolos nos serviços de saúde e compartilhar avanços em pesquisas na área.",Departamento de Nutrição,DN,0.011273448773448772,0.8495266,19.902632103323107,False
234,Bebê que mama: orientações e cuidados em amamentação,Extensão,Projeto de Extensão,2017-05-01,2026-11-30,Inadimplente,KEILA CRISTINA MASCARELLO,Departamento de Ciências da Saúde,DCS/CEUNES,"Meta-análises indicam que a amamentação confere proteção contra infecções na infância e maloclusão, aumenta a inteligência, e
provavelmente reduz a ocorrência de sobrepeso e diabetes. Para mulheres, a amamentação fornece proteção contra o câncer de
mama e aumenta o intervalo interpartal, e também pode proteger contra o câncer de ovário e o diabetes tipo 2.
A OMS, Unicef e o MS recomendam que a amamentação seja exclusiva nos primeiros 6 meses de vida e complementada até 2 anos de idade ou mais. Todavia, a duração mediana do
aleitamento materno exclusivo no Brasil foi de 54,1 dias (1,8 meses) e a da amamentação foi de 341,6 dias (11,2 meses).
A oferta de serviços especializados em amamentação podem ser decisivos para o início e manutenção do aleitamento materno.  O município de São Mateus, não possuía até então nenhum serviço especializado em atendimento à mulheres, gestantes e puérperas, recém-nascidos e suas famílias para apoio, orientação e cuidados em
amamentação.",amamentação,Saúde da criança,saúde da mulher,,"Meta-análises indicam que a amamentação confere proteção contra infecções na infância e maloclusão, aumenta a inteligência, e
provavelmente reduz a ocorrência de sobrepeso e diabetes. Para mulheres, a amamentação fornece proteção contra o câncer de
mama e aumenta o intervalo interpartal, e também pode proteger contra o câncer de ovário e o diabetes tipo 2. A ampliação da
amamentação a um nível quase universal poderia prevenir 823.000 mortes a cada ano em crianças menores de 5 anos e 20.000
mortes por câncer de mama (Victora, et al, 2016).
A OMS, o Fundo das Nações Unidas para a Infância (Unicef) e o Ministério da Saúde do Brasil (MS) recomendam que a
amamentação seja exclusiva nos primeiros 6 meses de vida e complementada até 2 anos de idade ou mais. Todavia, as práticas
alimentares de crianças pequenas, segundo dados da II Pesquisa de Prevalência de Aleitamento Materno nas capitais brasileiras
e no Distrito Federal, revelam que o Brasil ainda está muito aquém das recomendações da OMS. A duração mediana do
aleitamento materno exclusivo (AME) foi de 54,1 dias (1,8 meses) e a da amamentação foi de 341,6 dias (11,2 meses).
De acordo com dados da Pesquisa Nacional de Demografia e Saúde (PNDS), 40,1% das crianças menores de 6 meses e 77,1%
das crianças de 6 a 12 meses consumiram leite não materno no dia anterior à entrevista, sendo que 62,4% e 77,1% dessas
crianças, respectivamente, consumiram leite de vaca, que não é recomendado no primeiro ano de vida (BORTOLINI et al., 2013).
Mediante tal cenário, o grande desafio do profissional de saúde no apoio ao aleitamento materno é superar a sua práxis. Isso
implica não somente a necessidade de conhecimento técnico, mas, sobretudo, conhecimentos, habilidades e atitudes para
acolher dúvidas, preocupações, dificuldades das mães e seus familiares, por meio de escuta ativa, que propicie disponibilidade,
empatia e percepção para propor ações factíveis e congruentes ao contexto de cada família (BRASIL, 2010).",Departamento de Ciências da Saúde,DCS/CEUNES,0.011261662803827182,0.8493366,19.952399159032858,False
4480,"VII Símpósio de Diversidade Étnico-Racial: Políticas Afirmativas, Formação de Professores e Práticas Educativas",Extensão,Evento de Extensão,2024-08-07,2024-08-09,Concluído,ALEXANDRE DOS SANTOS ANASTACIO,Departamento de Química e Física,DQF/CCENS,"O VII Simpósio de Diversidade Étnico-Racial: políticas afirmativas, formação de professores(as) e práticas educativas pretende se constituir como espaço tempo de diálogo e reflexão sobre a Educação das relações étnico-raciais, sua articulação com as políticas públicas, formação de professores(as) e práticas educativas voltadas aos estudantes negros(as) e indígenas nos diferentes sistemas educacionais brasileiros. Assim, a sétima ediçao do evento consubstancia o trabalho desenvolvido por pesquisadores(as)/professores(as) e movimentos sociais vinculados à Universidade do Espirito Santo ao ""Grupo de Estudo Étnico-Racial e Educação Especial"" (GEERE) e ao Programa de Pós-Graduação em Ensino, Educação Básica e Formação de Professores (PPGEEDUC/Ufes).  O evento irá contar com a participação de pesquisadores da UFBA, FLACSO, UENF,  UERJ, UFSCar e IFRJ que desenvolvem estudos no campo da Educação das Relações Étnico-Raciais. ",ERER,Políticas Afirmativas,Formação de Professores,Práticas Educativas,"O VII Simpósio de Diversidade Étnico-Racial pretende se constituir como espaço tempo de diálogo e reflexão sobre a Educação das relações étnico-raciais, sua articulação com as políticas públicas, formação de professores(as) e práticas educativas voltadas aos estudantes negros(as) e indígenas nos diferentes sistemas educacionais brasileiros. Ressalta-se a importância dessa discussão no contexto político, econômico, social e educacional no país, marcado por (in)tensos debates relacionados ao processo de implementação da Lei nº 10.639, de 9 de janeiro de 2003 que, altera a LDB/96, que estabelece as diretrizes e bases da educação nacional, para incluir no currículo oficial de todos os níveis e modalidades de Ensino a obrigatoriedade da temática ""História e Cultura Afro­ brasileira"". Assim como, os desafios de sua implementação nos currículos e práticas educativas, com vistas a construção de uma educação antirracista. Esse cenário aponta desafios que necessitam de ampla discussão e posicionamento dos(as) pesquisadores(as) e dos(as) profissionais que atuam nesse campo. Considera-se que esse debate também seja de extrema importância no Espírito Santo, tendo em vista a necessidade de acompanhamento e avaliação da implementação da Lei n° 10.639/03 nas escolas dos municípios capixabas, bem como a incorporação das Diretrizes Curriculares Nacionais para a educação das Relações étnico-raciais (BRASIL, 2004) nas práticas escolares. Assim, a sétima edição do evento consubstancia o trabalho desenvolvido por pesquisadores(as)/professores(as) e movimentos sociais vinculados à Universidade do Espirito Santo ao ""Grupo de Estudo Étnico-Racial e Educação Especial"" (GEERE) e ao Programa de Pós-Graduação em Ensino, Educação Básica e Formação de Professores (PPGEEDUC/Ufes).  O evento irá contar com a participação de pesquisadores da UFBA, FLACSO, UENF, UERJ, UFSCar e IFRJ que desenvolvem estudos no campo da Educação das Relações Étnico-Raciais.",Departamento de Química e Física,DQF/CCENS,0.011232876712328768,0.8532798,15.37106517760953,True
